{
  "contract": "everypivot.semantic_evidence",
  "version": "1.0",
  "collection_id": "sanctions-case",
  "sources": [
    {
      "id": "relationship-source",
      "publisher": "Synthetic historical records",
      "document": "owner-source.json",
      "revision": "fixture-r1",
      "collection": "sanctions-case",
      "independent_origin": null,
      "content_hash": {
        "algorithm": "sha256",
        "value": "a0c26ce682abdb6fb2876273bc71da6d232c4a37933cf330f77a34dda85e9d9c",
        "scope": "exact_source_bytes"
      }
    },
    {
      "id": "list-source",
      "publisher": "Synthetic list provider",
      "document": "owner-source.json",
      "revision": "fixture-r1",
      "collection": "sanctions-case",
      "independent_origin": null,
      "content_hash": {
        "algorithm": "sha256",
        "value": "a0c26ce682abdb6fb2876273bc71da6d232c4a37933cf330f77a34dda85e9d9c",
        "scope": "exact_source_bytes"
      }
    },
    {
      "id": "correction-source",
      "publisher": "Synthetic historical records",
      "document": "owner-source.json",
      "revision": "fixture-r1",
      "collection": "sanctions-case",
      "independent_origin": null,
      "content_hash": {
        "algorithm": "sha256",
        "value": "a0c26ce682abdb6fb2876273bc71da6d232c4a37933cf330f77a34dda85e9d9c",
        "scope": "exact_source_bytes"
      }
    },
    {
      "id": "list-correction-source",
      "publisher": "Synthetic list provider",
      "document": "owner-source.json",
      "revision": "fixture-r1",
      "collection": "sanctions-case",
      "independent_origin": null,
      "content_hash": {
        "algorithm": "sha256",
        "value": "a0c26ce682abdb6fb2876273bc71da6d232c4a37933cf330f77a34dda85e9d9c",
        "scope": "exact_source_bytes"
      }
    }
  ],
  "records": [
    {
      "id": "seed",
      "kind": "entity",
      "type": "person",
      "attributes": {
        "name": "Selected source"
      },
      "times": {},
      "evidence": [
        {
          "source_id": "relationship-source",
          "field": "/claims/seed"
        }
      ]
    },
    {
      "id": "listed-subject",
      "kind": "entity",
      "type": "org:org",
      "attributes": {
        "name": "Actually identified list subject"
      },
      "times": {},
      "evidence": [
        {
          "source_id": "relationship-source",
          "field": "/claims/listed-subject"
        }
      ]
    },
    {
      "id": "relationship",
      "kind": "assertion",
      "type": "org:reported_beneficial_owner",
      "attributes": {
        "assertion_namespace": "owner:relationship",
        "source_category": "beneficial_owner",
        "category_mapping": "exact_source_category_v1",
        "stated_basis": "reported_economic_interest",
        "directness": "direct",
        "amount": {
          "value": 5,
          "unit": "percent",
          "rights_type": "economic_interest",
          "denominator": "issued_ordinary_shares",
          "share_class": "ordinary",
          "calculation_basis": "source_reported"
        }
      },
      "times": {
        "published": {
          "binding": {
            "object": "relationship",
            "occurrence": "relationship"
          },
          "field": "/claims/relationship/published",
          "source_revision": "fixture-r1",
          "clock": {
            "id": "source-stated-utc",
            "reference": "UTC",
            "uncertainty_seconds": 0
          },
          "timezone": "UTC",
          "precision": "instant",
          "interval_role": "occurrence",
          "value": "2026-09-02T00:00:00Z"
        },
        "applicable": {
          "binding": {
            "object": "relationship",
            "occurrence": "relationship"
          },
          "field": "/claims/relationship/applicable",
          "source_revision": "fixture-r1",
          "clock": {
            "id": "source-stated-utc",
            "reference": "UTC",
            "uncertainty_seconds": 0
          },
          "timezone": "UTC",
          "precision": "interval",
          "interval_role": "validity",
          "start": "2024-01-01T00:00:00Z",
          "end": "2024-12-31T23:59:59Z",
          "start_inclusive": true,
          "end_inclusive": true
        }
      },
      "evidence": [
        {
          "source_id": "relationship-source",
          "field": "/claims/relationship"
        }
      ],
      "subject": "seed",
      "object": "listed-subject"
    },
    {
      "id": "entry",
      "kind": "entity",
      "type": "sanction:entry",
      "attributes": {
        "list_id": "synthetic-list",
        "entry_id": "synthetic-entry-1",
        "entry_revision": "revision-2026-09-02"
      },
      "times": {},
      "evidence": [
        {
          "source_id": "list-source",
          "field": "/claims/entry"
        }
      ]
    },
    {
      "id": "entry-subject",
      "kind": "assertion",
      "type": "sanction:entry_subject",
      "attributes": {
        "assertion_namespace": "owner:entry-subject",
        "role": "source_listed_subject",
        "identity_basis": "exact_source_identifier"
      },
      "times": {
        "published": {
          "binding": {
            "object": "entry-subject",
            "occurrence": "entry-subject"
          },
          "field": "/claims/entry-subject/published",
          "source_revision": "fixture-r1",
          "clock": {
            "id": "source-stated-utc",
            "reference": "UTC",
            "uncertainty_seconds": 0
          },
          "timezone": "UTC",
          "precision": "instant",
          "interval_role": "occurrence",
          "value": "2026-09-02T00:00:00Z"
        }
      },
      "evidence": [
        {
          "source_id": "list-source",
          "field": "/claims/entry-subject"
        }
      ],
      "subject": "listed-subject",
      "object": "entry"
    },
    {
      "id": "status",
      "kind": "assertion",
      "type": "sanction:status",
      "attributes": {
        "assertion_namespace": "owner:status",
        "status": "listed",
        "list_id": "synthetic-list",
        "entry_revision": "revision-2026-09-02"
      },
      "times": {
        "published": {
          "binding": {
            "object": "status",
            "occurrence": "status"
          },
          "field": "/claims/status/published",
          "source_revision": "fixture-r1",
          "clock": {
            "id": "source-stated-utc",
            "reference": "UTC",
            "uncertainty_seconds": 0
          },
          "timezone": "UTC",
          "precision": "instant",
          "interval_role": "occurrence",
          "value": "2026-09-02T00:00:00Z"
        },
        "applicable": {
          "binding": {
            "object": "entry",
            "occurrence": "status"
          },
          "field": "/claims/status/applicable",
          "source_revision": "fixture-r1",
          "clock": {
            "id": "source-stated-utc",
            "reference": "UTC",
            "uncertainty_seconds": 0
          },
          "timezone": "UTC",
          "precision": "interval",
          "interval_role": "validity",
          "start": "2026-09-01T00:00:00Z",
          "end": "2026-12-31T23:59:59Z",
          "start_inclusive": true,
          "end_inclusive": true
        }
      },
      "evidence": [
        {
          "source_id": "list-source",
          "field": "/claims/status"
        }
      ],
      "subject": "entry",
      "object": "listed-subject"
    },
    {
      "id": "relationship-receipt",
      "kind": "occurrence",
      "type": "evidence:claim_receipt",
      "attributes": {
        "assertion_namespace": "owner:relationship-receipt",
        "collection_id": "sanctions-case"
      },
      "times": {
        "received": {
          "binding": {
            "object": "relationship",
            "occurrence": "relationship-receipt"
          },
          "field": "/claims/relationship-receipt/received",
          "source_revision": "fixture-r1",
          "clock": {
            "id": "source-stated-utc",
            "reference": "UTC",
            "uncertainty_seconds": 0
          },
          "timezone": "UTC",
          "precision": "instant",
          "interval_role": "occurrence",
          "value": "2026-09-03T00:00:00Z"
        }
      },
      "evidence": [
        {
          "source_id": "relationship-source",
          "field": "/claims/relationship-receipt"
        }
      ],
      "subject": "relationship"
    },
    {
      "id": "entry-subject-receipt",
      "kind": "occurrence",
      "type": "evidence:claim_receipt",
      "attributes": {
        "assertion_namespace": "owner:entry-subject-receipt",
        "collection_id": "sanctions-case"
      },
      "times": {
        "received": {
          "binding": {
            "object": "entry-subject",
            "occurrence": "entry-subject-receipt"
          },
          "field": "/claims/entry-subject-receipt/received",
          "source_revision": "fixture-r1",
          "clock": {
            "id": "source-stated-utc",
            "reference": "UTC",
            "uncertainty_seconds": 0
          },
          "timezone": "UTC",
          "precision": "instant",
          "interval_role": "occurrence",
          "value": "2026-09-03T00:00:00Z"
        }
      },
      "evidence": [
        {
          "source_id": "list-source",
          "field": "/claims/entry-subject-receipt"
        }
      ],
      "subject": "entry-subject"
    },
    {
      "id": "status-receipt",
      "kind": "occurrence",
      "type": "evidence:claim_receipt",
      "attributes": {
        "assertion_namespace": "owner:status-receipt",
        "collection_id": "sanctions-case"
      },
      "times": {
        "received": {
          "binding": {
            "object": "status",
            "occurrence": "status-receipt"
          },
          "field": "/claims/status-receipt/received",